{
  "evidence": [
    {
      "kind": "redacted_log",
      "path_or_ref": "evidence/g26-second-root-20261021T012953Z.json",
      "scrubbed": true,
      "sha256": "f3210b35e97f824e67d7366b855c34f7d255002d49461fc4470124f451491346"
    }
  ],
  "execution_boundary": "real_host",
  "expected": "Fresh-root quickstart and applicable gate/identity review; clean OS not implied; claims no broader than evidence.",
  "gate_id": "G26",
  "gate_key": "clean_install",
  "gate_title": "Documented clean install and claims",
  "identity_fingerprint": "7b5d41632623fa8e3bbf78ff23d8413b3a17d7f1997d06f03f390eb38945b969",
  "implementation_commit": "3f52b654ce06fc4a54ad186f858bc369d74f3fed",
  "limitations": [
    "The runner automates documented commands; a new integration root is not a clean-OS installation study.",
    "Display-attached GPU; 16 graphics clients recorded by G10.",
    "Profile enables KV streaming with an explicitly bounded resident KV window; not the low-RAM resident-expert variant."
  ],
  "metrics": [
    {
      "boundary": "real_host rtxpro6000-win-a",
      "method": "unavailable",
      "name": "fetch_wall",
      "unit": "s",
      "value": null
    },
    {
      "boundary": "real_host rtxpro6000-win-a",
      "method": "monotonic_wall_clock",
      "name": "install_wall",
      "unit": "s",
      "value": 572.632
    },
    {
      "boundary": "real_host rtxpro6000-win-a",
      "method": "monotonic_wall_clock",
      "name": "first_start_wall",
      "unit": "s",
      "value": 46.28
    },
    {
      "boundary": "real_host rtxpro6000-win-a",
      "method": "unavailable",
      "name": "first_start_ready",
      "unit": "s",
      "value": null
    },
    {
      "boundary": "real_host rtxpro6000-win-a",
      "method": "monotonic_wall_clock",
      "name": "quickstart_example_wall",
      "unit": "s",
      "value": 5.775
    },
    {
      "boundary": "real_host rtxpro6000-win-a",
      "method": "monotonic_wall_clock",
      "name": "quickstart_tests_wall",
      "unit": "s",
      "value": 0.059
    }
  ],
  "observed": "New integration root on a host that keeps earlier integration roots; not a fresh OS. Documented command sequence: install: {\"exit\": 0, \"wall_s\": 572.632}; start: {\"exit\": 0, \"wall_s\": 46.28}; tracer: {\"protocol_pass\": 3, \"runs\": 3, \"task_pass\": 3}; example: {\"exit\": 0, \"project_tests_pass_after\": true, \"wall_s\": 5.775}; independent tests: {\"exit\": 0, \"wall_s\": 0.059}; final stop: {\"exit\": 0, \"wall_s\": 3.795}. Installed identity: profile: \"win11-rtxpro6000-iq3s-262k-slots4-parking-strata0.2.1-omp18.10.1\"; runtime digest: \"92a1a5cff3f6fbf8da666011e8a6a7d7f05c12a1383168044d07f309633a68fb\". Runner: quickstart rc=0, pass_observed=True.",
  "profile_id": "win11-rtxpro6000-iq3s-262k-slots4-parking-strata0.2.1-omp18.10.1",
  "retry_history": [],
  "run_id": "g26-second-root-20261021T012953Z",
  "schema_version": 1,
  "status": "pass",
  "timestamp_utc": "2026-10-21T01:29:48.406183Z"
}
