{
  "evidence": [
    {
      "kind": "config_audit",
      "path_or_ref": "profiles/win11-rtxpro6000-iq3s-131k-slots4-parking-strata0.1.40.3-omp18.8.4.json",
      "scrubbed": true,
      "sha256": null
    }
  ],
  "execution_boundary": "evaluation",
  "expected": "Same-boundary rerun with declared engine/model/hardware differences; no borrowed headline measurements.",
  "gate_id": "G25",
  "gate_key": "comparison",
  "gate_title": "Controlled NInfer comparison",
  "identity_fingerprint": "61de544a8f5f003f61b2b987f3b2203a9d20c409970f0a48c363110325adb54b",
  "implementation_commit": "f365c88e23b16904820b5402ac83db7ccf0a67b0",
  "limitations": [],
  "metrics": [],
  "observed": "Capability or claim disabled; nothing was run.",
  "profile_id": "win11-rtxpro6000-iq3s-131k-slots4-parking-strata0.1.40.3-omp18.8.4",
  "reason": "No comparative claim (claims.comparative_claims false); NInfer was not rerun and no NInfer measurements are borrowed.",
  "retry_history": [],
  "run_id": "g25-not-applicable-20261008",
  "schema_version": 1,
  "status": "not_applicable",
  "timestamp_utc": "2026-10-08T17:05:04Z"
}
