{
  "evidence": [
    {
      "kind": "redacted_log",
      "path_or_ref": "evidence/g21-20261013T073146Z-b804f7.json",
      "scrubbed": true,
      "sha256": "ae2813f19e20a712b47b5c780d2bebbde34e6b2adeb12d9328f4e1892c42a679"
    }
  ],
  "execution_boundary": "real_host",
  "expected": "Measured peak RAM/VRAM/disk, startup and failures; conservative reproducible fit.",
  "gate_id": "G21",
  "gate_key": "resources",
  "gate_title": "Resource and stability record",
  "identity_fingerprint": "a5f1cd405bdd648c95f2676327620d65a09e72d54a1a087d76a353ff0840a89d",
  "implementation_commit": "d2fac6154b6392bd7b263efc1b7d7301774ff0b4",
  "limitations": [
    "Lifetime process peaks describe the surviving tree; sampling can miss transient peaks.",
    "Fault-probe disconnects and deliberate engine kills are retained, not an indefinite stability claim.",
    "Profile enables KV streaming with an explicitly bounded resident KV window; not the low-RAM resident-expert variant."
  ],
  "metrics": [
    {
      "boundary": "real_host rtx5090-win-a",
      "method": "resource_sampler",
      "name": "engine_peak_working_set",
      "unit": "bytes",
      "value": 30601625600
    },
    {
      "boundary": "real_host rtx5090-win-a",
      "method": "resource_sampler",
      "name": "engine_peak_private_commit",
      "unit": "bytes",
      "value": 63449346048
    },
    {
      "boundary": "real_host rtx5090-win-a",
      "method": "resource_sampler",
      "name": "gpu_memory_used_peak",
      "unit": "MiB",
      "value": 30836
    },
    {
      "boundary": "real_host rtx5090-win-a",
      "method": "resource_sampler",
      "name": "min_available_ram_serving",
      "unit": "bytes",
      "value": 7573716992
    },
    {
      "boundary": "real_host rtx5090-win-a",
      "method": "resource_sampler",
      "name": "disk_root_total",
      "unit": "bytes",
      "value": 69311181068
    },
    {
      "boundary": "real_host rtx5090-win-a",
      "method": "unavailable",
      "name": "completed_requests_logged",
      "unit": "count",
      "value": null
    },
    {
      "boundary": "real_host rtx5090-win-a",
      "method": "unavailable",
      "name": "first_ready",
      "unit": "s",
      "value": null
    },
    {
      "boundary": "real_host rtx5090-win-a",
      "method": "monotonic_wall_clock",
      "name": "current_ready",
      "unit": "s",
      "value": 11.8
    },
    {
      "boundary": "real_host rtx5090-win-a",
      "method": "unavailable",
      "name": "expert_load_rate",
      "unit": "GB/s",
      "value": null
    }
  ],
  "observed": "Resource and failure record: engine lifetime peaks: [{\"peak_private\": 806912, \"peak_working_set\": 4112384, \"private\": 782336, \"process\": \"python.exe\", \"working_set\": 4100096}, {\"peak_private\": 63449346048, \"peak_working_set\": 30601625600, \"private\": 63331446784, \"process\": \"strata.exe\", \"working_set\": 30483951616}, {\"peak_private\": 205467648, \"peak_working_set\": 219607040, \"private\": 205361152, \"process\": \"python.exe\", \"working_set\": 219553792}, {\"peak_private\": 1146880, \"peak_working_set\": 7282688, \"private\": 1110016, \"process\": \"conhost.exe\", \"working_set\": 7266304}]; root disk bytes: 69311181068; current readiness seconds: 11.8; first startup: unavailable; engine failure counts: {\"engine_error_lines\": 0, \"found_dead_and_restarted\": 2, \"requests_ended_disconnect\": 5, \"requests_ended_error\": 1, \"stopped_mid_request\": 1}; log scan: unavailable. Cross-gate samples: GPU peak MiB: 30836; minimum available RAM bytes: 7573716992. Runner: g21 rc=0, pass_observed=None.",
  "profile_id": "win11-rtx5090-coder-iq1m-131k-strata0.1.43.1-omp18.10.1",
  "reason": "Measurement-only probe: pass requires recorded resource peaks, startup and engine-failure counts, not pass_observed.",
  "retry_history": [],
  "run_id": "g21-20261013T073146Z-b804f7",
  "schema_version": 1,
  "status": "pass",
  "timestamp_utc": "2026-10-13T07:31:47Z"
}
