{
  "evidence": [
    {
      "kind": "config_audit",
      "path_or_ref": "profiles/win11-rtx5090-coder-iq1m-131k-strata0.1.43-omp18.10.1.json",
      "scrubbed": true,
      "sha256": null
    }
  ],
  "execution_boundary": "real_host",
  "expected": "Actual vision artifacts, images/tools/format conversion/context and compaction tested; otherwise capability disabled.",
  "gate_id": "G22",
  "gate_key": "vision",
  "gate_title": "Optional images",
  "identity_fingerprint": "5ec70fe3147c6c417564419a72cc5df141ab667ec9fcb9404c70b0b8d0e3bc65",
  "implementation_commit": "f6fa4d0cd2cb105bb87ad0915b50a350eab51375",
  "limitations": [],
  "metrics": [],
  "observed": "Capability or claim disabled; nothing was run.",
  "profile_id": "win11-rtx5090-coder-iq1m-131k-strata0.1.43-omp18.10.1",
  "reason": "Vision is disabled (capabilities.vision false); only text input is offered to OMP.",
  "retry_history": [],
  "run_id": "g22-not-applicable-20261012",
  "schema_version": 1,
  "status": "not_applicable",
  "timestamp_utc": "2026-10-12T19:14:00Z"
}
