{
  "evidence": [
    {
      "kind": "config_audit",
      "path_or_ref": "profiles/win11-rtxpro6000-iq3s-262k-slots4-parking-strata0.1.42-omp18.8.9.json",
      "scrubbed": true,
      "sha256": null
    }
  ],
  "execution_boundary": "real_host",
  "expected": "Actual vision artifacts, images/tools/format conversion/context and compaction tested; otherwise capability disabled.",
  "gate_id": "G22",
  "gate_key": "vision",
  "gate_title": "Optional images",
  "identity_fingerprint": "7ee9263ca729bf308ef3c14a0196e0608b216da93140ee9a5cd6be638a993660",
  "implementation_commit": "ced1f083a62d6853c3da8ff1d3b13afa0b0307a4",
  "limitations": [],
  "metrics": [],
  "observed": "Capability or claim disabled; nothing was run.",
  "profile_id": "win11-rtxpro6000-iq3s-262k-slots4-parking-strata0.1.42-omp18.8.9",
  "reason": "Vision is disabled (capabilities.vision false); only text input is offered to OMP.",
  "retry_history": [],
  "run_id": "g22-not-applicable-20261011",
  "schema_version": 1,
  "status": "not_applicable",
  "timestamp_utc": "2026-10-11T06:05:45Z"
}
