{
  "evidence": [
    {
      "kind": "redacted_log",
      "path_or_ref": "evidence/g17-20261012T164928Z-0ab331.json",
      "scrubbed": true,
      "sha256": "9f7fb682efd36a48f9743442ce8cd8c2f818c6d580631917f08335db746f0407"
    }
  ],
  "execution_boundary": "real_host",
  "expected": "Tokenized prompt plus reserved output within actual limit; near-limit tool follow-up; explicit overflow error.",
  "gate_id": "G17",
  "gate_key": "context",
  "gate_title": "Declared capacity and overflow",
  "identity_fingerprint": "5ec70fe3147c6c417564419a72cc5df141ab667ec9fcb9404c70b0b8d0e3bc65",
  "implementation_commit": "f6fa4d0cd2cb105bb87ad0915b50a350eab51375",
  "limitations": [
    "Output caps reserve budgets; they do not count generated output tokens.",
    "Profile enables KV streaming with an explicitly bounded resident KV window; not the low-RAM resident-expert variant."
  ],
  "metrics": [
    {
      "boundary": "real_host rtx5090-win-a",
      "method": "server_reported",
      "name": "cold_prefill",
      "unit": "ms",
      "value": 13825
    },
    {
      "boundary": "real_host rtx5090-win-a",
      "method": "server_reported",
      "name": "boundary_prompt_tokens",
      "unit": "tokens",
      "value": 100030
    },
    {
      "boundary": "real_host rtx5090-win-a",
      "method": "server_reported",
      "name": "near_limit_peak_prompt_tokens",
      "unit": "tokens",
      "value": 105360
    },
    {
      "boundary": "real_host rtx5090-win-a",
      "method": "calculated",
      "name": "max_wire_prompt_plus_cap",
      "unit": "tokens",
      "value": 129997
    },
    {
      "boundary": "real_host rtx5090-win-a",
      "method": "server_reported",
      "name": "near_limit_cold_prefill",
      "unit": "ms",
      "value": 14555.2
    },
    {
      "boundary": "real_host rtx5090-win-a",
      "method": "monotonic_wall_clock",
      "name": "near_limit_task_wall",
      "unit": "ms",
      "value": 16834.7
    },
    {
      "boundary": "real_host rtx5090-win-a",
      "method": "calculated",
      "name": "cold_prefill_rate",
      "unit": "tokens/s",
      "value": 7235.443037974684
    }
  ],
  "observed": "Context boundary: context: 131072; slack: 8; fit and overflow: {\"cold_prefill_ms\": 13825, \"fit\": {\"cached\": 100023, \"max_tokens\": 31034, \"status\": 200}, \"over\": {\"max_tokens\": 31035, \"never_truncated_message\": true, \"status\": 400}, \"prompt_tokens\": 100030}; near-limit prompt peak: 105360; wire prompt plus cap: 129997; facts retained: true; tool follow-up: true; compactions: 0; client overflow: {\"engine_requests_served\": 0, \"error_surfaced\": true, \"exit\": 1, \"stops\": [], \"wall_ms\": 655.0}. Runner: g17 rc=0, pass_observed=True.",
  "profile_id": "win11-rtx5090-coder-iq1m-131k-strata0.1.43-omp18.10.1",
  "retry_history": [],
  "run_id": "g17-20261012T164928Z-0ab331",
  "schema_version": 1,
  "status": "pass",
  "timestamp_utc": "2026-10-12T16:50:03Z"
}
