{
  "evidence": [
    {
      "kind": "redacted_log",
      "path_or_ref": "evidence/g14-20261028T102603Z-564a49.json",
      "scrubbed": true,
      "sha256": "eee00f1e8a1fd35c17d187fbbe941c3e24a27a7b3d9a1cd05d7ebdf8a3da08b3"
    },
    {
      "kind": "redacted_log",
      "path_or_ref": "evidence/g14q-20261028T102635Z-a63720.json",
      "scrubbed": true,
      "sha256": "5e97a03c5d7e4d45c504a6cf4c086ad42dfb6cef74610712b000dda05a1d2636"
    }
  ],
  "execution_boundary": "real_host",
  "expected": "Generate/queue cancellation and transport loss; next turn valid; no false completion or duplicate side effects.",
  "gate_id": "G14",
  "gate_key": "real_cancel",
  "gate_title": "Real fault recovery",
  "identity_fingerprint": "b526cdcb1d7a21359a31d5a07ef14d2b637a7b2dce5d9e5e0fddad06d6e27613",
  "implementation_commit": "15c742615207e4f8ce888991f852728e57e1a88a",
  "limitations": [
    "Profile enables KV streaming with an explicitly bounded resident KV window; not the low-RAM resident-expert variant."
  ],
  "metrics": [
    {
      "boundary": "real_host rtx3090-win-a",
      "method": "monotonic_wall_clock",
      "name": "generating_cancel_to_idle",
      "unit": "ms",
      "value": 69
    },
    {
      "boundary": "real_host rtx3090-win-a",
      "method": "monotonic_wall_clock",
      "name": "queued_drop_then_active_drop_to_idle",
      "unit": "ms",
      "value": 265
    },
    {
      "boundary": "real_host rtx3090-win-a",
      "method": "external_verifier",
      "name": "g14q_long_requests_after_queued_disconnect_ok",
      "unit": "count",
      "value": 4
    }
  ],
  "observed": "Cancellation and side effects: generating client: {\"engine_finish\": [\"disconnect\"], \"engine_output_tokens\": [94], \"generated_at_kill\": 92, \"server_idle\": true, \"server_idle_after_ms\": 69, \"was_generating\": true}; queued cancellation: {\"engine_records\": [{\"finish\": \"disconnect\", \"output_tokens\": 934}, {\"finish\": \"stop\", \"output_tokens\": 3}, {\"finish\": \"stop\", \"output_tokens\": 3}, {\"finish\": \"stop\", \"output_tokens\": 3}, {\"finish\": \"stop\", \"output_tokens\": 3}, {\"finish\": \"stop\", \"output_tokens\": 3}], \"engine_restarted_during_follow_ups\": false, \"first_continued_after_queued_drop\": true, \"first_generating\": true, \"follow_up_requests\": [{\"correct\": true, \"error\": null, \"status\": 200}, {\"correct\": true, \"error\": null, \"status\": 200}, {\"correct\": true, \"error\": null, \"status\": 200}, {\"correct\": true, \"error\": null, \"status\": 200}, {\"correct\": true, \"error\": null, \"status\": 200}], \"idle_after_first_dropped\": true, \"idle_after_ms\": 265, \"queued_observed\": true, \"slots\": 1}; append after resume: {\"append_runs_in_transcript\": 1, \"killed_during_generation\": true, \"log_lines_after_resume\": 1, \"log_lines_before_resume\": 1, \"resume_exit\": 0, \"resume_reports_one_line\": true, \"side_effect_seen\": true}; failed-tool recovery: {\"exit\": 0, \"reported\": true, \"stops\": [\"toolUse\", \"stop\"]}. Queued-drop regressions: control: {\"a_generating\": true, \"b_queued\": false, \"first_long_request\": {\"engine_replaced\": false, \"error\": null, \"prompt_tokens\": 8123, \"status\": 200}, \"second_long_request\": {\"engine_replaced\": false, \"error\": null, \"prompt_tokens\": 8123, \"status\": 200}}; active completion: {\"a_generating\": true, \"b_queued\": true, \"first_long_request\": {\"engine_replaced\": false, \"error\": null, \"prompt_tokens\": 8123, \"status\": 200}, \"second_long_request\": {\"engine_replaced\": false, \"error\": null, \"prompt_tokens\": 8123, \"status\": 200}}; active drop: {\"a_generating\": true, \"b_queued\": true, \"first_long_request\": {\"engine_replaced\": false, \"error\": null, \"prompt_tokens\": 8123, \"status\": 200}, \"second_long_request\": {\"engine_replaced\": false, \"error\": null, \"prompt_tokens\": 8123, \"status\": 200}}. Runner: g14 rc=0, pass_observed=True, g14q rc=0, pass_observed=True.",
  "profile_id": "win11-rtx3090-rtx4090-iq3s-262k-pw2-disp4090-roles-parking-strata0.2.7-omp18.13.2",
  "retry_history": [],
  "run_id": "g14-20261028T102603Z-564a49",
  "schema_version": 1,
  "status": "pass",
  "timestamp_utc": "2026-10-28T10:26:33Z"
}
