{
  "evidence": [
    {
      "kind": "test_report",
      "path_or_ref": "evidence/host-free-suite-20261008-2c32e2b.txt",
      "scrubbed": true,
      "sha256": "baa89aaccef726f0bfb3e62844a305385a1784cdb015c7ac6ccf6fcbe846aac3"
    }
  ],
  "execution_boundary": "host_free",
  "expected": "Typed streamed tool round trip, fragments, UTF-8 and finish semantics through the actual client.",
  "gate_id": "G03",
  "gate_key": "stock_client_mock",
  "gate_title": "Real OMP with scripted HTTP/SSE",
  "identity_fingerprint": "54fa22f25e79ecd7ce002109b3cad61e386f6e0fa9ab66e65c00e003ef8b54f7",
  "implementation_commit": "2c32e2b2f3d2abfba3acb524f5b2ecf465e346af",
  "limitations": [
    "Host-free macOS suite at 2c32e2b: 380 tests in 233.472 s, OK with 1 skipped test (the pinned Strata leaves a cut call's JSON unterminated); pinned stock OMP 18.8.4 and Strata v0.1.40.3 frontend. Mocks do not qualify GPU behavior."
  ],
  "metrics": [
    {
      "boundary": "host_free macOS",
      "method": "calculated",
      "name": "tests_run",
      "unit": "count",
      "value": 380
    },
    {
      "boundary": "host_free macOS",
      "method": "calculated",
      "name": "skipped_tests",
      "unit": "count",
      "value": 1
    },
    {
      "boundary": "host_free macOS",
      "method": "calculated",
      "name": "expected_failures",
      "unit": "count",
      "value": 0
    },
    {
      "boundary": "host_free macOS",
      "method": "monotonic_wall_clock",
      "name": "suite_wall",
      "unit": "s",
      "value": 233.472
    }
  ],
  "observed": "Streamed text, fragmented typed read/write/bash calls, UTF-8 arguments, multiple fragmented reads, usage and finish semantics round-trip through actual OMP 18.8.4; composed tests use the pinned Strata v0.1.40.3 frontend and MockEngine.",
  "profile_id": "win11-rtx3090-coder-iq1m-131k-strata0.1.40.3-omp18.8.4",
  "retry_history": [],
  "run_id": "g03-suite-20261008-2c32e2b",
  "schema_version": 1,
  "status": "pass",
  "timestamp_utc": "2026-10-08T17:05:04Z"
}
