{
  "evidence": [
    {
      "kind": "test_report",
      "path_or_ref": "evidence/host-free-suite-20261012-f6fa4d0.txt",
      "scrubbed": true,
      "sha256": "e268c6b183eeda5801b9713fc26cbda0fb9f20974b968acc24620cf00459af9d"
    }
  ],
  "execution_boundary": "host_free",
  "expected": "Reject missing identities, placeholders, invalid budgets, hash drift and ready-without-evidence.",
  "gate_id": "G01",
  "gate_key": "pins_schema",
  "gate_title": "Pins and manifest validation",
  "identity_fingerprint": "5ec70fe3147c6c417564419a72cc5df141ab667ec9fcb9404c70b0b8d0e3bc65",
  "implementation_commit": "f6fa4d0cd2cb105bb87ad0915b50a350eab51375",
  "limitations": [
    "Host-free macOS suite at f6fa4d0: 517 tests in 209.009 s, OK with 1 skipped test (the pinned Strata leaves a cut call's JSON unterminated); pinned stock OMP 18.10.1 and Strata v0.1.43 frontend. Mocks do not qualify GPU behavior."
  ],
  "metrics": [
    {
      "boundary": "host_free macOS",
      "method": "calculated",
      "name": "tests_run",
      "unit": "count",
      "value": 517
    },
    {
      "boundary": "host_free macOS",
      "method": "calculated",
      "name": "skipped_tests",
      "unit": "count",
      "value": 1
    },
    {
      "boundary": "host_free macOS",
      "method": "calculated",
      "name": "expected_failures",
      "unit": "count",
      "value": 0
    },
    {
      "boundary": "host_free macOS",
      "method": "monotonic_wall_clock",
      "name": "suite_wall",
      "unit": "s",
      "value": 209.009
    }
  ],
  "observed": "The 517-test host-free suite passes with no expected failures: profile, receipt and release validation rejects missing identities, placeholders, invalid budgets, hash drift, fingerprint mismatch and ready/qualified states without evidence; publication refuses unscrubbed evidence, foreign identities and duplicate receipts. Batch slots are admitted only as 2 to 8 (stock setup --parallel), and pinned stock recommendations only at the values stock setup prints, applied to the expected engine flags.",
  "profile_id": "win11-rtx5090-coder-iq1m-131k-strata0.1.43-omp18.10.1",
  "retry_history": [],
  "run_id": "g01-suite-20261012-f6fa4d0",
  "schema_version": 1,
  "status": "pass",
  "timestamp_utc": "2026-10-12T19:14:00Z"
}
