{
  "evidence": [
    {
      "kind": "redacted_log",
      "path_or_ref": "evidence/g11-tracer1-20261008T135450Z-e5bf05.json",
      "scrubbed": true,
      "sha256": "d42df943eeb4767117dc26352a2fe6459205f5743007cd6b31d6caea1d559fd1"
    }
  ],
  "execution_boundary": "real_host",
  "expected": "Three independent typed tool-cycle runs; verifier-confirmed successful fixes; preserve protocol and task-quality failures separately.",
  "gate_id": "G11",
  "gate_key": "real_tool_loop",
  "gate_title": "Real stock OMP and Strata tool turns",
  "identity_fingerprint": "61de544a8f5f003f61b2b987f3b2203a9d20c409970f0a48c363110325adb54b",
  "implementation_commit": "f365c88e23b16904820b5402ac83db7ccf0a67b0",
  "limitations": [
    "Display-attached GPU; 12 graphics clients recorded by G10.",
    "Profile enables KV streaming with an explicitly bounded resident KV window; not the low-RAM resident-expert variant."
  ],
  "metrics": [
    {
      "boundary": "real_host rtxpro6000-win-a",
      "method": "external_verifier",
      "name": "protocol_passes",
      "unit": "count",
      "value": 3
    },
    {
      "boundary": "real_host rtxpro6000-win-a",
      "method": "external_verifier",
      "name": "task_passes",
      "unit": "count",
      "value": 3
    },
    {
      "boundary": "real_host rtxpro6000-win-a",
      "method": "monotonic_wall_clock",
      "name": "run1_turn1_wall",
      "unit": "ms",
      "value": 6149.3
    },
    {
      "boundary": "real_host rtxpro6000-win-a",
      "method": "external_verifier",
      "name": "run1_tool_calls",
      "unit": "count",
      "value": 6
    },
    {
      "boundary": "real_host rtxpro6000-win-a",
      "method": "monotonic_wall_clock",
      "name": "run2_turn1_wall",
      "unit": "ms",
      "value": 3427.3
    },
    {
      "boundary": "real_host rtxpro6000-win-a",
      "method": "external_verifier",
      "name": "run2_tool_calls",
      "unit": "count",
      "value": 5
    },
    {
      "boundary": "real_host rtxpro6000-win-a",
      "method": "monotonic_wall_clock",
      "name": "run3_turn1_wall",
      "unit": "ms",
      "value": 4099.5
    },
    {
      "boundary": "real_host rtxpro6000-win-a",
      "method": "external_verifier",
      "name": "run3_tool_calls",
      "unit": "count",
      "value": 6
    }
  ],
  "observed": "Tracer run 1: protocol pass: true; task pass: true; tool calls: 6; unique IDs: true; object arguments: true; all results: true; original nonce recalled: true; rotated nonce recalled: false; continuation tool calls: 0. Tracer run 2: protocol pass: true; task pass: true; tool calls: 5; unique IDs: true; object arguments: true; all results: true; original nonce recalled: true; rotated nonce recalled: false; continuation tool calls: 0. Tracer run 3: protocol pass: true; task pass: true; tool calls: 6; unique IDs: true; object arguments: true; all results: true; original nonce recalled: true; rotated nonce recalled: false; continuation tool calls: 0. Runner: tracer rc=0, pass_observed=True.",
  "profile_id": "win11-rtxpro6000-iq3s-131k-slots4-parking-strata0.1.40.3-omp18.8.4",
  "retry_history": [],
  "run_id": "g11-tracer1-20261008T135450Z-e5bf05",
  "schema_version": 1,
  "status": "pass",
  "timestamp_utc": "2026-10-08T13:55:08.090605Z"
}
