{
  "evidence": [
    {
      "kind": "redacted_log",
      "path_or_ref": "evidence/g13-20261028T093758Z-5f8bbf.json",
      "scrubbed": true,
      "sha256": "2f13bad71c06e02acf91f10ee34f796428c98c01d96c405bbef4950def41577d"
    }
  ],
  "execution_boundary": "real_host",
  "expected": "Wrong/missing key refused on generation routes; dead endpoint fails; auxiliary routing and test egress controls evidenced.",
  "gate_id": "G13",
  "gate_key": "local_only",
  "gate_title": "Authentication and no-cloud behavior",
  "identity_fingerprint": "6f8fc6b2683ef4e1118b36401b93517916b31a1da12949260cc96e85d9f47e3d",
  "implementation_commit": "9d3cf88a59b45f00449fbbe7019241e93be3d1a5",
  "limitations": [
    "ETW is a bounded observation, not a firewall or OS sandbox; loopback discovery is not external egress.",
    "Display-attached GPU; 2 graphics clients recorded by G10.",
    "Profile enables KV streaming with an explicitly bounded resident KV window; not the low-RAM resident-expert variant."
  ],
  "metrics": [
    {
      "boundary": "ETW kernel-network bounded probe",
      "method": "external_verifier",
      "name": "non_loopback_events",
      "unit": "count",
      "value": 0
    },
    {
      "boundary": "ETW kernel-network bounded probe",
      "method": "external_verifier",
      "name": "etw_events_attributed",
      "unit": "count",
      "value": 10067
    },
    {
      "boundary": "real_host rtxpro6000-win-a",
      "method": "monotonic_wall_clock",
      "name": "dead_endpoint_failure_wall",
      "unit": "ms",
      "value": 32591.1
    },
    {
      "boundary": "real_host rtxpro6000-win-a",
      "method": "monotonic_wall_clock",
      "name": "wrong_key_failure_wall",
      "unit": "ms",
      "value": 1025.9
    }
  ],
  "observed": "Authentication and routing: protected routes enforced: true; correct key accepted: true; absent opt-in routes: {\"/api-monitor\": 404, \"/api/requests\": 404, \"/tool-media/\": 404, \"/v1/images/files/\": 404, \"POST /v1/images/generations\": 404}; CORS preflight: {\"allow_origin\": null, \"status\": 204}; launcher refusals: {\"blank\": \"refused_before_launch\", \"empty\": \"refused_before_launch\", \"missing\": \"refused_before_launch\"}; wrong-key client: {\"engine_requests\": 0, \"exit\": 1, \"wall_ms\": 1025.9}; dead-endpoint client: {\"exit\": 1, \"timed_out\": false, \"wall_ms\": 32591.1}; ETW probe: {\"compactions_observed\": 1, \"conclusive\": true, \"events_attributed\": 10067, \"events_total\": 200268, \"exits\": [0, 0], \"loopback_dport_events\": {\"11434\": 2, \"1234\": 6, \"18090\": 6686, \"54560\": 88, \"54561\": 63, \"54573\": 510, \"54578\": 44, \"54579\": 569, \"54584\": 596, \"54585\": 973, \"54596\": 520, \"8080\": 4, \"9\": 2, \"9931\": 4}, \"method\": \"etw-kernel-network\", \"non_loopback_endpoints\": 0, \"non_loopback_events\": 0, \"started\": true}; route census: {\"apis\": [\"openai-completions\"], \"models\": [\"qwen3.8-flash-next-iq3_s\"], \"providers\": [\"strata-local\"], \"sessions\": 6}; settings unchanged: true. Runner: g13 rc=0, pass_observed=True.",
  "profile_id": "win11-rtxpro6000-iq3s-262k-slots4-parking-strata0.2.7-omp18.13.2",
  "retry_history": [],
  "run_id": "g13-20261028T093758Z-5f8bbf",
  "schema_version": 1,
  "status": "pass",
  "timestamp_utc": "2026-10-28T09:39:13Z"
}
