{
  "evidence": [
    {
      "kind": "test_report",
      "path_or_ref": "evidence/host-free-suite-20261023-a915c69.txt",
      "scrubbed": true,
      "sha256": "b344d1b049b172852ff20f2a1aecc24cdbb69e2299cdf6f31857b7454c768c79"
    }
  ],
  "execution_boundary": "host_free",
  "expected": "Typed streamed tool round trip, fragments, UTF-8 and finish semantics through the actual client.",
  "gate_id": "G03",
  "gate_key": "stock_client_mock",
  "gate_title": "Real OMP with scripted HTTP/SSE",
  "identity_fingerprint": "5b7afa359ee0394f3e9fc8f10843ef5544ae413d9d805edfdc1bcdadded07c80",
  "implementation_commit": "a915c694399ddaf814e89f7087e2347f82dce8dd",
  "limitations": [
    "Host-free macOS suite at a915c69: 720 tests in 237.537 s, OK with 4 skipped tests (the pinned Strata leaves a cut call's JSON unterminated; needs Linux /proc; needs Linux /proc; needs Linux /proc); pinned stock OMP 18.12.6 and Strata v0.2.3 frontend. Mocks do not qualify GPU behavior."
  ],
  "metrics": [
    {
      "boundary": "host_free macOS",
      "method": "calculated",
      "name": "tests_run",
      "unit": "count",
      "value": 720
    },
    {
      "boundary": "host_free macOS",
      "method": "calculated",
      "name": "skipped_tests",
      "unit": "count",
      "value": 4
    },
    {
      "boundary": "host_free macOS",
      "method": "calculated",
      "name": "expected_failures",
      "unit": "count",
      "value": 0
    },
    {
      "boundary": "host_free macOS",
      "method": "monotonic_wall_clock",
      "name": "suite_wall",
      "unit": "s",
      "value": 237.537
    }
  ],
  "observed": "Streamed text, fragmented typed read/write/bash calls, UTF-8 arguments, multiple fragmented reads, usage and finish semantics round-trip through actual OMP 18.12.6; composed tests use the pinned Strata v0.2.3 frontend and MockEngine.",
  "profile_id": "win11-rtx5090-coder-iq1m-131k-strata0.2.3-omp18.12.6",
  "retry_history": [],
  "run_id": "g03-suite-20261023-a915c69",
  "schema_version": 1,
  "status": "pass",
  "timestamp_utc": "2026-10-23T13:57:12Z"
}
